[
  {
    "id": "Trainer Equipment",
    "name": "Trainer Equipment",
    "description": "Pokémon class-exclusive. An item that increases a stat of your choice by 2 during a combat encounter. Only you can benefit from this item. The boosted stat cannot be changed once it has been chosen.",
    "category": "Trainer Equipment",
    "rarity": "Uncommon",
    "price": 1050,
    "is_consumable": false,
    "size": "1x1",
    "sprite": "items/Trainer Equipment.png",
    "equipslot": "gear",
    "sprite_url": "https://raw.githubusercontent.com/PokeAPI/sprites/master/sprites/items/never-melt-ice.png",
    "mechanics": [
      {
        "action": "WEATHER_IMMUNITY",
        "target": "SELF",
        "value": 0
      }
    ]
  },
  {
    "id": "basic-tool-kit",
    "name": "Basic Tool Kit",
    "description": "A set of tools for basic repairs and maintenance. One kit comes in a tackle box and includes a hammer, a screwdriver with an adaptable head, a wrench, a handsaw, a steel ruler, a level, 40 assorted nails, 40 assorted screws, 40 assorted nuts and bolts. 8 lbs. 14x6x6 in.",
    "category": "Trainer Equipment",
    "rarity": "Common",
    "price": 150,
    "is_consumable": false,
    "size": "2x2",
    "sprite": "items/basic-tool-kit.png",
    "sprite_url": "https://raw.githubusercontent.com/PokeAPI/sprites/master/sprites/items/dome-fossil.png",
    "mechanics": [
      {
        "action": "MAINTENANCE",
        "target": "SELF",
        "value": 0
      }
    ]
  },
  {
    "id": "berry-planter",
    "name": "Berry Planter",
    "description": "A micro-environment designed to rapidly cultivate berries. A shrub planted from a single berry can eventually sprout 2–3 new berries. 3 lbs. 2x1x1 ft. 4 ft strap. | When this device is used, roll a Nature check. Then once a day for the next 5 days, water the plant and roll another Nature check. If you roll below 6 even once, then the plant will yield 1 berry. Rolling over 20 will yield 3 berries. Otherwise, it will bear 2. Failing to water the shrub and/or harvesting the berries will kill the plant.",
    "category": "Trainer Equipment",
    "rarity": "Uncommon",
    "price": 2800,
    "is_consumable": false,
    "size": "4x2",
    "sprite": "items/berry-planter.png",
    "sprite_url": "https://raw.githubusercontent.com/PokeAPI/sprites/master/sprites/items/wailmer-pail.png",
    "mechanics": [
      {
        "action": "GROW_BERRY",
        "target": "SELF",
        "value": 0
      }
    ]
  },
  {
    "id": "bracing-sleeves",
    "name": "Bracing Sleeves",
    "description": "A special piece of clothing that grants +2 to an Athletics skill check.",
    "category": "Trainer Equipment",
    "rarity": "Uncommon",
    "price": 800,
    "is_consumable": false,
    "size": "1x1",
    "sprite": "items/bracing-sleeves.png",
    "equipslot": "armor",
    "sprite_url": "https://raw.githubusercontent.com/PokeAPI/sprites/master/sprites/items/macho-brace.png",
    "mechanics": [
      {
        "action": "TALENT_BOOST",
        "target": "SELF",
        "value": 2,
        "affect": "athletics"
      }
    ]
  },
  {
    "id": "camera-bag",
    "name": "Camera Bag",
    "description": "A bag equipped with everything a travelling photographer needs, minus the camera. One bag includes 3 lenses, 2 extra bulbs, gaffer tape, microfiber cloth, a micro screwdriver, a micro flashlight, an spare battery, a 20 GB memory card, and ear plugs. 18x10x8 in. 3 lbs.",
    "category": "Trainer Equipment",
    "rarity": "Common",
    "price": 150,
    "is_consumable": false,
    "size": "3x2",
    "sprite": "items/camera-bag.png",
    "sprite_url": "https://raw.githubusercontent.com/PokeAPI/sprites/master/sprites/items/tm-case.png",
    "mechanics": [
      {
        "action": "PHOTOGRAPHY",
        "target": "SELF",
        "value": 0
      }
    ]
  },
  {
    "id": "clothing-equipment",
    "name": "Clothing Equipment",
    "description": "Designer-exclusive (Coordinator). A custom item that adds 1 to a skill check when using the item for its intended purpose. This item loses this effect for two weeks or until it is repaired (with the Tactical Design feature). This effect does not stack.",
    "category": "Trainer Equipment",
    "rarity": "Common",
    "price": 0,
    "is_consumable": false,
    "size": "1x1",
    "sprite": "items/clothing-equipment.png",
    "equipslot": "armor",
    "sprite_url": "https://raw.githubusercontent.com/PokeAPI/sprites/master/sprites/items/silk-scarf.png",
    "mechanics": [
      {
        "action": "TALENT_BOOST",
        "target": "SELF",
        "value": 1,
        "affect": "any"
      }
    ]
  },
  {
    "id": "coiled-styler",
    "name": "Coiled Styler",
    "description": "Special Operative-exclusive (Ranger). A special component that allows a capture styler to restrain owned Pokémon. This component was designed to combat poachers and criminals who abuse Pokémon. | 3/day. As an action, the wielder may use the move Wrap on a Pokémon. Pokémon bound by this function cannot move or use attacks, unless they break free (with a disadvantaged, contested Athletics check).",
    "category": "Trainer Equipment",
    "rarity": "Rare",
    "price": 0,
    "is_consumable": false,
    "size": "1x1",
    "sprite": "",
    "equipslot": "onehand",
    "sprite_url": "https://raw.githubusercontent.com/PokeAPI/sprites/master/sprites/items/capture-styler.png",
    "mechanics": [
      {
        "action": "MOVE_WRAP",
        "target": "AREA",
        "value": 3
      }
    ]
  },
  {
    "id": "cooking-kit",
    "name": "Cooking Kit",
    "description": "A kit equipped with everything a chef on-the-go needs. One kit includes a portable 2-burner electric stove, a cast iron pan, a cast iron pot with lid, a water purifier, a cutting board, a knife, measuring cups and spoons, a spatula, a cooking spoon, and a sturdy bag. The electric stove can be used for 2 weeks after a 4-hour charge. 35 lbs. 2x2x1 ft. 4 ft strap.",
    "category": "Trainer Equipment",
    "rarity": "Uncommon",
    "price": 850,
    "is_consumable": false,
    "size": "4x2",
    "sprite": "items/cooking-kit.png",
    "sprite_url": "https://raw.githubusercontent.com/PokeAPI/sprites/master/sprites/items/old-gateau.png",
    "mechanics": [
      {
        "action": "COOKING",
        "target": "SELF",
        "value": 0
      }
    ]
  },
  {
    "id": "desert-gear",
    "name": "Desert Gear",
    "description": "Apparel carefully designed to protect humans in sandstorms, desert winds, and hot conditions. | Humans will not take damage in the Sandstorm weather effect.",
    "category": "Trainer Equipment",
    "rarity": "Uncommon",
    "price": 1050,
    "is_consumable": false,
    "size": "1x1",
    "sprite": "items/desert-gear.png",
    "equipslot": "armor",
    "sprite_url": "https://raw.githubusercontent.com/PokeAPI/sprites/master/sprites/items/soft-sand.png",
    "mechanics": [
      {
        "action": "WEATHER_IMMUNITY",
        "target": "SELF",
        "value": 0
      }
    ]
  },
  {
    "id": "dig-kit",
    "name": "Dig Kit",
    "description": "A kit equipped with everything a digger needs. One kit includes an extendable shovel, an extendable pickaxe, a hammer, a trowel, a compass, a 25 ft measuring tape, 10 6\" stakes (10), 600 ft of string, and a tool roll bag with room for more equipment. 15 lbs. 16x6x4 in. 4ft strap.",
    "category": "Trainer Equipment",
    "rarity": "Common",
    "price": 150,
    "is_consumable": false,
    "size": "3x2",
    "sprite": "items/dig-kit.png",
    "sprite_url": "https://raw.githubusercontent.com/PokeAPI/sprites/master/sprites/items/explorer-kit.png",
    "mechanics": [
      {
        "action": "DIGGING",
        "target": "SELF",
        "value": 0
      }
    ]
  },
  {
    "id": "domino-mask",
    "name": "Domino Mask",
    "description": "A special piece of clothing that grants +2 to a Bluff / Deception skill check.",
    "category": "Trainer Equipment",
    "rarity": "Uncommon",
    "price": 800,
    "is_consumable": false,
    "size": "1x1",
    "sprite": "items/domino-mask.png",
    "equipslot": "armor",
    "sprite_url": "https://raw.githubusercontent.com/PokeAPI/sprites/master/sprites/items/dubious-disc.png",
    "mechanics": [
      {
        "action": "TALENT_BOOST",
        "target": "SELF",
        "value": 2,
        "affect": "bluff"
      }
    ]
  },
  {
    "id": "drawing-kit",
    "name": "Drawing Kit",
    "description": "A kit equipped with everything a drawer or a doodler needs. One kit includes a drawing pad (200 pages), a journal (200 pages), 10 blue pencils, 2 mechanical pencils, a kneaded eraser, a white vinyl eraser, a blender, pen and ink, 10 assorted pen brushes, and a bag with to carry it all with room to spare. 4 lbs. 20x18x3 in. 3ft strap.",
    "category": "Trainer Equipment",
    "rarity": "Common",
    "price": 20,
    "is_consumable": false,
    "size": "3x2",
    "sprite": "",
    "sprite_url": "https://raw.githubusercontent.com/PokeAPI/sprites/master/sprites/items/adventure-guide.png",
    "mechanics": [
      {
        "action": "ART",
        "target": "SELF",
        "value": 0
      }
    ]
  },
  {
    "id": "egg-incubator",
    "name": "Egg Incubator",
    "description": "An electronic, reuseable container that keeps Pokémon eggs warm and safe. This item lasts can protect an egg for a month on a 4-hour charge. It is sturdy enough to be dropped from 100 ft without harming the egg. It is also watertight and insulating. Although heavy, an incubator is much more convenient than carrying an egg on its own. Carrying 2 can mean for tight luggage. 15 lbs. 16x8x8 in. 4 ft. strap.",
    "category": "Trainer Equipment",
    "rarity": "Rare",
    "price": 1350,
    "is_consumable": false,
    "size": "2x4",
    "sprite": "items/incubator-empty.png",
    "equipslot": "gear",
    "sprite_url": "https://raw.githubusercontent.com/PokeAPI/sprites/master/sprites/items/egg-ticket.png",
    "mechanics": [
      {
        "action": "EGG_HATCH",